Name,Cost,Rarity,Type,Description,ImageID
Sir Bailey,$5 ,NA,Action – Attack – Knight,"+1 Card; +1 Action | ""Each other player reveals the top 2 cards of his deck, trashes one of them costing from $3 to $6, and discards the rest. If a Knight is trashed by this, trash this card.""",
Sir Destry,$5 ,NA,Action – Attack – Knight,"+2 Cards | ""Each other player reveals the top 2 cards of his deck, trashes one of them costing from $3 to $6, and discards the rest. If a Knight is trashed by this, trash this card.""",
Sir Martin,$4 ,NA,Action – Attack – Knight,"+2 Buys | ""Each other player reveals the top 2 cards of his deck, trashes one of them costing from $3 to $6, and discards the rest. If a Knight is trashed by this, trash this card.""",
Sir Michael,$5 ,NA,Action – Attack – Knight,"Each other player discards down to 3 cards in hand. | ""Each other player reveals the top 2 cards of his deck, trashes one of them costing from $3 to $6, and discards the rest. If a Knight is trashed by this, trash this card.""",
Sir Vander,$5 ,NA,Action – Attack – Knight,"Each other player reveals the top 2 cards of his deck, trashes one of them costing from $3 to $6, and discards the rest. If a Knight is trashed by this, trash this card. | ___ | ""When this is trashed, gain a Gold.""",
Smithy,$4 ,NA,Action,+3 Cards.,
Smugglers,$3 ,NA,Action,Gain a copy of a card costing up to $6 that the player to your right gained on his last turn.,
Soothsayer,$5 ,NA,Action – Attack,Gain a Gold. Each other player gains a Curse. Each player who did draws a card.,
Spice Merchant,$4 ,NA,Action,"You may trash a Treasure from your hand. If you do, choose one: | +2 Cards and +1 Action; | or +$2 and +1 Buy.",
Spoils,$0*,NA,Treasure,"+$3  | ""When you play this, return it to the pile.""",
Spy,$4 ,NA,Action – Attack,"+1 Card; +1 Action | ""Each player (including you) reveals the top card of his deck and either discards it or puts it back, your choice.""",
Squire,$2 ,NA,Action,"+$1  | Choose one: +2 Actions; or +2 Buys; or gain a Silver. | ___ | ""When you trash this, gain an Attack card.""",
Stables,$5 ,NA,Action,"You may discard a Treasure. If you do, +3 Cards and +1 Action.",
Stash,$5 ,NA,Treasure,"Worth $2 | ""When you shuffle, you may put this anywhere in your deck.""",
Steward,$3 ,NA,Action,Choose one: +2 Cards; or +$2; or trash 2 cards from your hand.,
Stonemason,$2+,NA,Action,"Trash a card from your hand. Gain 2 cards each costing less than it. | — | ""When you buy this, you may overpay for it. If you do, gain 2 Action cards each costing the amount you overpaid.""",
Storeroom,$3 ,NA,Action,+1 Buy | Discard any number of cards. +1 Card per card discarded. Discard any number of cards. +$1 per card discarded the second time.,
Survivors,$0 ,NA,Action – Ruins,Look at the top 2 cards of your deck. Discard them or put them back in any order.,
Swindler,$3 ,NA,Action – Attack,$2  | Each other player trashes the top card of his deck and gains a card with the same cost that you choose.,
Tactician,$5 ,NA,Action – Duration,"Discard your hand. If you discarded any cards this way, then at the start of your next turn, +5 Cards; +1 Buy; and +1 Action.",
Talisman,$4 ,NA,Treasure,"Worth $1. | ""While this is in play, when you buy a card costing $4 or less that is not a Victory card, gain a copy of it.""",
Taxman,$4 ,NA,Action – Attack,"You may trash a Treasure from your hand. Each other player with 5 or more cards in hand discards a copy of it (or reveals a hand without it). Gain a Treasure card costing up to $3 more than the trashed card, putting it on top of your deck.",
Thief,$4 ,NA,Action – Attack,"Each other player reveals the top 2 cards of his deck. If they revealed any Treasure cards, they trash one of them that you choose. You may gain any or all of these trashed cards. They discard the other revealed cards.",
Throne Room,$4 ,NA,Action,Choose an Action card in your hand. Play it twice.,
Torturer,$5 ,NA,Action – Attack,"+3 Cards | ""Each other player chooses one: he discards 2 cards; or he gains a Curse card, putting it in his hand.""",
Tournament,$4 ,NA,Action,"+1 Action | Each player may reveal a Province from his hand. | ""If you do, discard it and gain a Prize (from the Prize pile) or a Duchy, putting it on top of your deck."" | ""If no-one else does, +1 Card, +$1.""",
Trade Route,$3 ,NA,Action,"+1 Buy; +$1 per token on the Trade Route mat. | ""Trash a card from your hand.Setup: Put a token on each Victory card Supply pile. When a card is gained from that pile, move the token to the Trade Route mat.""",
Trader,$4 ,NA,Action – Reaction,"Trash a card from your hand. Gain a number of Silvers equal to its cost in coins. | — | ""When you would gain a card, you may reveal this from your hand. If you do, instead, gain a silver.""",
Trading Post,$5 ,NA,Action,"Trash 2 cards from your hand. If you do, gain a silver card; put it into your hand.",
Transmute,$0•,NA,Action,"Trash a card from your hand. If it is anâ€¦ Action card, gain a Duchy; Treasure card, gain a Transmute; Victory card, gain a Gold.",
Treasure Map,$4 ,NA,Action,"Trash this and another copy of Treasure Map from your hand. If you do trash two Treasure Maps, gain 4 Gold cards, putting them on top of your deck.",
Treasury,$5 ,NA,Action,"+1 Card; +1 Action; +$1 | ""When you discard this from play, if you didn't buy a Victory card this turn, you may put this on top of your deck.""",
Tribute,$5 ,NA,Action,"The player to your left reveals then discards the top 2 cards of his deck. For each differently named card revealed, if it is anâ€¦ Action Card; +2 Actions; Treasure Card; +$2; Victory Card; +2 Cards.",
Tunnel,$3 ,NA,Victory – Reaction,"2 Victory Points | — | ""When you discard this other than during a Clean-up phase, you may reveal it. If you do, gain a Gold.""",
University,$2•,NA,Action,+2 Actions | You may gain an Action card costing up to $5.,
Upgrade,$5 ,NA,Action,+1 Card; +1 Action | Trash a card from your hand. Gain a card costing exactly $1 more than it.,
Urchin,$3 ,NA,Action – Attack,"+1 Card; +1 Action | Each other player discards down to 4 cards in hand. | ___ | ""When you play another Attack card with this in play, you may trash this. If you do, gain a Mercenary from the Mercenary pile.""",
Vagrant,$2 ,NA,Action,"+1 Card; +1 Action | ""Reveal the top card of your deck. If it's a Victory card, Curse, Ruins, or Shelter, put it into your hand.""",
Vault,$5 ,NA,Action,"+2 Cards | ""Discard any number of cards. +$1 per card discarded. Each other player may discard 2 cards. If he does, he draws a card.""",
Venture,$5 ,NA,Treasure,"Worth $1 | ""When you play this, reveal cards from your deck until you reveal a Treasure. Discard the other cards. Play that Treasure.""",
Village,$3 ,NA,Action,+1 Card; +2 Actions.,
Vineyard,$0•,NA,Victory,Worth 1 Victory Point for every 3 Action cards in your deck (rounded down).,
Walled Village,$4 ,NA,Action,"+1 Card; +2 Actions | — | ""At the start of Clean-up, if you have this and no more than one other Action card in play, you may put this on top of your deck.""",
Wandering Minstrel,$4 ,NA,Action,+1 Card; +2 Actions | Reveal the top 3 cards of your deck. Put the Actions back on top in any order and discard the rest.,
Warehouse,$3 ,NA,Action,+3 Cards; +1 Action | Discard 3 cards.,
Watchtower,$3 ,NA,Action – Reaction,"Draw until you have 6 cards in hand. | ""When you gain a card, you may reveal this from your hand. If you do, either trash that card, or put it on top of your deck.""",
Wharf,$5 ,NA,Action – Duration,Now and at the start of your next turn: +2 Cards; +1 Buy.,
Wishing Well,$3 ,NA,Action,"+1 Card; +1 Action | ""Name a card, then reveal the top card of your deck. If it is the named card, put it in your hand.""",
Witch,$5 ,NA,Action – Attack,+2 Cards | Each other player gains a Curse card.,
Woodcutter,$3 ,NA,Action,+1 Buy; +$2.,
Worker's Village,$4 ,NA,Action,"+1 Card; +2 Actions, +1 Buy",
Workshop,$3 ,NA,Action,Gain a card costing up to $4.,
Young Witch,$4 ,NA,Action – Attack,"+2 Cards | ""Discard 2 cards. Each other player may reveal a Bane card from his hand. If he doesn't, he gains a Curse.Setup: Add an extra Kingdom card pile costing $2 or $3 to the Supply. Cards from that pile are Bane cards.""",
Bag of Gold,$0*,NA,,,
Diadem,$0*,NA,,,
Followers,$0*,NA,,,
Princess,$0*,NA,,,
Trusty Steed,$0*,NA,,,
,,,Action – Prize,"+1 Action | ""Gain a Gold, putting it on top of your deck.""",
,,,Treasure – Prize,"Worth $2. | ""When you play this, +$1 per unused Action you have (Action, not Action card).""",
,,,Action – Attack – Prize,+2 Cards | Gain an Estate. Each other player gains a Curse and discards down to 3 cards in hand.,
,,,Action – Prize,"+1 Buy | ""While this is in play, cards cost $2 less, but not less than $0.""",
,,,Action – Prize,Choose two: +2 Cards; or +2 Actions; or +$2; or gain 4 Silvers and put your deck into your discard pile.,
